{
  "schemaVersion": "1.0.0",
  "id": "tale:template:chat-artifact-panel",
  "version": "1.0.0",
  "source": "source/App.tsx",
  "skeleton": "skeleton/App.tsx",
  "dependencies": {
    "@tale-ui/react": "^2.0.0",
    "react": ">=18.0.0"
  },
  "preview": {
    "recipe": "docs/recipes/chat-artifact-panel.md",
    "accessibility": "keyboard, screen-reader, zoom, contrast, and reduced-motion review required",
    "responsive": true
  },
  "golden": "tools/golden-prompts/chat-ordinary-data.json",
  "compatibility": {
    "react": ">=18.0.0",
    "tale": ">=2.0.0 <3.0.0",
    "frameworks": [
      "next",
      "vite"
    ]
  },
  "appearance": [
    "light",
    "dark"
  ],
  "rtl": true,
  "provenance": {
    "source": "docs/recipes/chat-artifact-panel.md",
    "firstParty": true
  },
  "license": "MIT",
  "digest": "sha256:f47a4de82563e9a8f338b47745e9c10d629d6d5df8d67391de9009993028b414"
}
