{
  "schemaVersion": "1.0.0",
  "id": "tale:template:app-header",
  "version": "2.0.0",
  "source": "source/App.tsx",
  "skeleton": "skeleton/App.tsx",
  "dependencies": {
    "@tale-ui/react": "^3.0.0",
    "react": ">=18.0.0",
    "lucide-react": "^0.468.0"
  },
  "preview": {
    "recipe": "docs/recipes/app-header-navigation.md",
    "accessibility": "keyboard, screen-reader, zoom, contrast, and reduced-motion review required",
    "responsive": true
  },
  "golden": "tools/golden-prompts/header-nav-basic.json",
  "compatibility": {
    "react": ">=18.0.0",
    "tale": ">=3.0.0 <4.0.0",
    "frameworks": [
      "next",
      "vite"
    ]
  },
  "appearance": [
    "light",
    "dark"
  ],
  "rtl": true,
  "provenance": {
    "source": "docs/recipes/app-header-navigation.md",
    "firstParty": true
  },
  "license": "MIT",
  "digest": "sha256:08fd22ada9e780cda40dbea9a40300dae0b681eb37f1d49c08b3f5c5887b9196"
}
