{
  "schemaVersion": "1.0.0",
  "id": "tale:template:react-hook-form",
  "version": "2.0.0",
  "source": "source/App.tsx",
  "skeleton": "skeleton/App.tsx",
  "dependencies": {
    "@tale-ui/react": "^3.0.0",
    "react": ">=18.0.0",
    "lucide-react": "^0.468.0",
    "react-hook-form": "^7.62.0"
  },
  "preview": {
    "recipe": "docs/recipes/react-hook-form.md",
    "accessibility": "keyboard, screen-reader, zoom, contrast, and reduced-motion review required",
    "responsive": true
  },
  "golden": "tools/golden-prompts/form-login.json",
  "compatibility": {
    "react": ">=18.0.0",
    "tale": ">=3.0.0 <4.0.0",
    "frameworks": [
      "next",
      "vite"
    ]
  },
  "appearance": [
    "light",
    "dark"
  ],
  "rtl": true,
  "provenance": {
    "source": "docs/recipes/react-hook-form.md",
    "firstParty": true
  },
  "license": "MIT",
  "digest": "sha256:61f70577ed5859fe291d3bc79259fd1f5e2351b3706b03310f16866b3d89ffe4"
}
