{
  "schemaVersion": "1.0.0",
  "id": "tale:template:chat-mobile",
  "version": "2.0.0",
  "source": "source/App.tsx",
  "skeleton": "skeleton/App.tsx",
  "dependencies": {
    "@tale-ui/react": "^3.0.0",
    "react": ">=18.0.0"
  },
  "preview": {
    "recipe": "docs/recipes/chat-mobile.md",
    "accessibility": "keyboard, screen-reader, zoom, contrast, and reduced-motion review required",
    "responsive": true
  },
  "golden": "tools/golden-prompts/chat-ordinary-data.json",
  "compatibility": {
    "react": ">=18.0.0",
    "tale": ">=3.0.0 <4.0.0",
    "frameworks": [
      "next",
      "vite"
    ]
  },
  "appearance": [
    "light",
    "dark"
  ],
  "rtl": true,
  "provenance": {
    "source": "docs/recipes/chat-mobile.md",
    "firstParty": true
  },
  "license": "MIT",
  "digest": "sha256:f89e21bf9b8e281092401edcba2725e6f28b50c5dd42cd6b710ca748c14346ab"
}
