{
  "schemaVersion": "1.0.0",
  "id": "tale:template:loading-patterns",
  "version": "2.0.0",
  "source": "source/App.tsx",
  "skeleton": "skeleton/App.tsx",
  "dependencies": {
    "@tale-ui/react": "^3.0.0",
    "react": ">=18.0.0"
  },
  "preview": {
    "recipe": "docs/recipes/loading-patterns.md",
    "accessibility": "keyboard, screen-reader, zoom, contrast, and reduced-motion review required",
    "responsive": true
  },
  "golden": "tools/golden-prompts/loading-spinner.json",
  "compatibility": {
    "react": ">=18.0.0",
    "tale": ">=3.0.0 <4.0.0",
    "frameworks": [
      "next",
      "vite"
    ]
  },
  "appearance": [
    "light",
    "dark"
  ],
  "rtl": true,
  "provenance": {
    "source": "docs/recipes/loading-patterns.md",
    "firstParty": true
  },
  "license": "MIT",
  "digest": "sha256:6c9749d7972982db4d51710ca6d4d2d583efd689ce592fad38c19fc3cd85470f"
}
