{
  "schemaVersion": "1.0.0",
  "id": "tale:template:validated-form",
  "version": "1.0.0",
  "source": "source/App.tsx",
  "skeleton": "skeleton/App.tsx",
  "dependencies": {
    "@tale-ui/react": "^2.0.0",
    "react": ">=18.0.0",
    "lucide-react": "^0.468.0"
  },
  "preview": {
    "recipe": "docs/recipes/form-with-validation.md",
    "accessibility": "keyboard, screen-reader, zoom, contrast, and reduced-motion review required",
    "responsive": true
  },
  "golden": "tools/golden-prompts/form-login.json",
  "compatibility": {
    "react": ">=18.0.0",
    "tale": ">=2.0.0 <3.0.0",
    "frameworks": [
      "next",
      "vite"
    ]
  },
  "appearance": [
    "light",
    "dark"
  ],
  "rtl": true,
  "provenance": {
    "source": "docs/recipes/form-with-validation.md",
    "firstParty": true
  },
  "license": "MIT",
  "digest": "sha256:72ea014ca23a68b054815c23609f82ce3910096b525553cf6950e1f6f317a680"
}
