{
  "schemaVersion": "1.0.0",
  "id": "tale:template:chart-dashboard",
  "version": "2.0.0",
  "source": "source/App.tsx",
  "skeleton": "skeleton/App.tsx",
  "dependencies": {
    "@tale-ui/react": "^3.0.0",
    "react": ">=18.0.0",
    "@tale-ui/charts": "^0.1.5"
  },
  "preview": {
    "recipe": "docs/recipes/dashboard-with-charts.md",
    "accessibility": "keyboard, screen-reader, zoom, contrast, and reduced-motion review required",
    "responsive": true
  },
  "golden": "tools/golden-prompts/area-chart-revenue.json",
  "compatibility": {
    "react": ">=18.0.0",
    "tale": ">=3.0.0 <4.0.0",
    "frameworks": [
      "next",
      "vite"
    ]
  },
  "appearance": [
    "light",
    "dark"
  ],
  "rtl": true,
  "provenance": {
    "source": "docs/recipes/dashboard-with-charts.md",
    "firstParty": true
  },
  "license": "MIT",
  "digest": "sha256:93146fe3c8bd88d47d06629a5e2a38b78c02ffcce812e8a635960b9b9546a2ad"
}
