{
  "schemaVersion": "1.0.0",
  "id": "tale:template:empty-state",
  "version": "2.0.0",
  "source": "source/App.tsx",
  "skeleton": "skeleton/App.tsx",
  "dependencies": {
    "@tale-ui/react": "^3.0.0",
    "react": ">=18.0.0",
    "lucide-react": "^0.468.0"
  },
  "preview": {
    "recipe": "docs/recipes/empty-data-state.md",
    "accessibility": "keyboard, screen-reader, zoom, contrast, and reduced-motion review required",
    "responsive": true
  },
  "golden": "tools/golden-prompts/empty-state-no-results.json",
  "compatibility": {
    "react": ">=18.0.0",
    "tale": ">=3.0.0 <4.0.0",
    "frameworks": [
      "next",
      "vite"
    ]
  },
  "appearance": [
    "light",
    "dark"
  ],
  "rtl": true,
  "provenance": {
    "source": "docs/recipes/empty-data-state.md",
    "firstParty": true
  },
  "license": "MIT",
  "digest": "sha256:70d119814baa06ad6ebb63db5184f14fd92e2d98c3fd6aba54b479b18b09f0a5"
}
