{
  "schemaVersion": "1.0.0",
  "id": "tale:template:settings-page",
  "version": "2.0.0",
  "source": "source/App.tsx",
  "skeleton": "skeleton/App.tsx",
  "dependencies": {
    "@tale-ui/react": "^3.0.0",
    "react": ">=18.0.0"
  },
  "preview": {
    "recipe": "docs/recipes/settings-page.md",
    "accessibility": "keyboard, screen-reader, zoom, contrast, and reduced-motion review required",
    "responsive": true
  },
  "golden": "tools/golden-prompts/settings-page.json",
  "compatibility": {
    "react": ">=18.0.0",
    "tale": ">=3.0.0 <4.0.0",
    "frameworks": [
      "next",
      "vite"
    ]
  },
  "appearance": [
    "light",
    "dark"
  ],
  "rtl": true,
  "provenance": {
    "source": "docs/recipes/settings-page.md",
    "firstParty": true
  },
  "license": "MIT",
  "digest": "sha256:e43ce6ec89295a11695f07fc21bcfed3834e088d285f440a64538f156de85c99"
}
